{
  "profileVersion": 1,
  "resourceId": "page-flows",
  "status": "verified",
  "verifiedAt": "2026-07-31",
  "summary": "Video recordings and screen recordings of real product user flows and interactions",
  "capabilities": ["product-flow-research", "motion-inspiration"],
  "contentObjects": ["product-flow", "motion-example", "pattern"],
  "platforms": ["web", "mobile"],
  "frameworks": [],
  "designTools": [],
  "deliveryFormats": ["web-page", "screenshot", "source-link"],
  "integrationMethods": ["website"],
  "agentInterfaces": [],
  "discovery": {
    "textSearch": true,
    "semanticSearch": "no",
    "facets": ["flow-type", "platform", "company"]
  },
  "workflowFit": ["user-onboarding-design", "interaction-flow-mapping"],
  "limitations": ["Pro videos require paid subscription"],
  "governance": {
    "defaultPersistence": "metadata-only",
    "assetRedistribution": "prohibited",
    "sourceAttribution": "required",
    "userCredentialRequired": false,
    "termsReviewRequired": true,
    "notes": ["Focuses on video recordings of user interactions"]
  },
  "evidence": [
    {
      "claim": "Video recording archive of user flows from popular applications",
      "sourceUrl": "https://pageflows.com",
      "sourceType": "official-product-page",
      "verifiedAt": "2026-07-31",
      "confidence": "certain"
    }
  ]
}
