{
  "profileVersion": 1,
  "resourceId": "typewolf",
  "status": "verified",
  "verifiedAt": "2026-07-31",
  "summary": "Independent typography guide, web font pairing showcase, and font trend reference",
  "capabilities": ["typography-inspiration", "editorial-design-research"],
  "contentObjects": ["website", "font", "article"],
  "platforms": ["web"],
  "frameworks": [],
  "designTools": [],
  "deliveryFormats": ["web-page", "screenshot", "source-link"],
  "integrationMethods": ["website"],
  "agentInterfaces": [],
  "discovery": {
    "textSearch": true,
    "semanticSearch": "no",
    "facets": ["font-family", "category", "site-of-the-day"]
  },
  "workflowFit": ["typography-pairings", "editorial-font-choice"],
  "limitations": ["Guides and checklists are paid products"],
  "governance": {
    "defaultPersistence": "metadata-only",
    "assetRedistribution": "prohibited",
    "sourceAttribution": "required",
    "userCredentialRequired": false,
    "termsReviewRequired": false,
    "notes": ["Definitive web typography reference"]
  },
  "evidence": [
    {
      "claim": "Web typography inspiration and font pairing recommendations",
      "sourceUrl": "https://www.typewolf.com",
      "sourceType": "official-product-page",
      "verifiedAt": "2026-07-31",
      "confidence": "certain"
    }
  ]
}
