{
  "profileVersion": 1,
  "resourceId": "21st-dev",
  "status": "verified",
  "verifiedAt": "2026-07-31",
  "summary": "Community React component registry with semantic search, CLI, and MCP for coding agents",
  "capabilities": [
    "component-library",
    "code-implementation",
    "mcp-integration"
  ],
  "contentObjects": ["component", "code", "documentation"],
  "platforms": ["web"],
  "frameworks": ["react", "tailwind"],
  "designTools": [],
  "deliveryFormats": [
    "source-code",
    "package",
    "documentation",
    "structured-data"
  ],
  "integrationMethods": ["website", "cli", "mcp"],
  "agentInterfaces": [
    {
      "type": "mcp",
      "transport": "http",
      "endpoint": "https://21st.dev/mcp",
      "authentication": "none",
      "credentialOwner": "none",
      "dataReturned": ["component-code", "installation-commands"],
      "persistencePolicy": "persistent",
      "status": "documented",
      "documentationUrl": "https://21st.dev/mcp"
    }
  ],
  "discovery": {
    "textSearch": true,
    "semanticSearch": "yes",
    "facets": ["category", "framework", "style"]
  },
  "workflowFit": ["component-discovery", "agent-ui-implementation"],
  "limitations": [
    "Free semantic search; paid tiers for advanced agent generation"
  ],
  "governance": {
    "defaultPersistence": "persistent",
    "assetRedistribution": "allowed",
    "sourceAttribution": "recommended",
    "userCredentialRequired": false,
    "termsReviewRequired": false,
    "notes": ["Open component registry for AI developers"]
  },
  "evidence": [
    {
      "claim": "21st.dev MCP enables semantic search and component code installation",
      "sourceUrl": "https://21st.dev/mcp",
      "sourceType": "official-documentation",
      "verifiedAt": "2026-07-31",
      "confidence": "certain"
    }
  ]
}
